Enter password: *****
Welcome to the MySQL monitor.  Commands end with ; or \g.
Your MySQL connection id is 36
Server version: 5.5.62 MySQL Community Server (GPL)

Copyright (c) 2000, 2018, Oracle and/or its affiliates. All rights reserved.

Oracle is a registered trademark of Oracle Corporation and/or its
affiliates. Other names may be trademarks of their respective
owners.

Type 'help;' or '\h' for help. Type '\c' to clear the current input statement.

mysql> use resturant;
Database changed
mysql> show tables;
+---------------------+
| Tables_in_resturant |
+---------------------+
| custdetails         |
| customer            |
| customerorder       |
| custpayment         |
| custroom            |
+---------------------+
5 rows in set (0.00 sec)

mysql> alter table custdetails add custoccupation varchar(200);
Query OK, 5 rows affected (0.01 sec)
Records: 5  Duplicates: 0  Warnings: 0

mysql> update custdetails set custoccupation="FARMER" where custid="20233";
Query OK, 1 row affected (0.01 sec)
Rows matched: 1  Changed: 1  Warnings: 0

mysql>  update custdetails set custoccupation="BUSINESS" where custid="20232";
Query OK, 1 row affected (0.01 sec)
Rows matched: 1  Changed: 1  Warnings: 0

mysql>  update custdetails set custoccupation="ENGINEER" where custid="20235";
Query OK, 1 row affected (0.01 sec)
Rows matched: 1  Changed: 1  Warnings: 0

mysql>  update custdetails set custoccupation="DANCER" where custid="20231";
Query OK, 1 row affected (0.01 sec)
Rows matched: 1  Changed: 1  Warnings: 0

mysql>  update custdetails set custoccupation="ACTOR" where custid="20234";;
Query OK, 1 row affected (0.01 sec)
Rows matched: 1  Changed: 1  Warnings: 0

ERROR:
No query specified

mysql>  update custdetails set custoccupation="STUDENT" where custid="20234";
Query OK, 1 row affected (0.01 sec)
Rows matched: 1  Changed: 1  Warnings: 0

mysql> select*from custdetails;
+--------+----------+--------------+-----------+------------+-------------------+-------------+--------------+----------------+
| custid | custname | custmobileno | custorder | custcharge | custpaymentmethod | custaddress | custaadharno | custoccupation |
+--------+----------+--------------+-----------+------------+-------------------+-------------+--------------+----------------+
|  20231 | SAI      |      6304632 | FOOD      |       1100 | UPI               | TS  |     45632198 | DANCER         |
|  20232 | SASI     |      7989632 | ROOM      |       2000 | CARD              | TS  |     78945612 | BUSINESS       |
|  20233 | RAVI     |      7989343 | FOOD      |       1200 | CASH              | AP  |     66498231 | FARMER         |
|  20234 | CHANDU   |      9390260 | ROOM      |       1600 | UPI               | TS  |     12345678 | STUDENT        |
|  20235 | BANNU    |     91823157 | FOOD      |        600 | CREDIT CARD       | TN  |     98712356 | ENGINEER       |
+--------+----------+--------------+-----------+------------+-------------------+-------------+--------------+----------------+
5 rows in set (0.00 sec)

mysql> select*from custdetails where custcharge BETWEEN 1200 and 2000;
+--------+----------+--------------+-----------+------------+-------------------+-------------+--------------+----------------+
| custid | custname | custmobileno | custorder | custcharge | custpaymentmethod | custaddress | custaadharno | custoccupation |
+--------+----------+--------------+-----------+------------+-------------------+-------------+--------------+----------------+
|  20232 | SASI     |      7989632 | ROOM      |       2000 | CARD              | TS  |     78945612 | BUSINESS       |
|  20233 | RAVI     |      7989343 | FOOD      |       1200 | CASH              | AP  |     66498231 | FARMER         |
|  20234 | CHANDU   |      9390260 | ROOM      |       1600 | UPI               | TS  |     12345678 | STUDENT        |
+--------+----------+--------------+-----------+------------+-------------------+-------------+--------------+----------------+
3 rows in set (0.00 sec)

mysql> select*from custdetails where custcharge NOT BETWEEN 1200 and 2000;
+--------+----------+--------------+-----------+------------+-------------------+-------------+--------------+----------------+
| custid | custname | custmobileno | custorder | custcharge | custpaymentmethod | custaddress | custaadharno | custoccupation |
+--------+----------+--------------+-----------+------------+-------------------+-------------+--------------+----------------+
|  20231 | SAI      |      6304632 | FOOD      |       1100 | UPI               | TS  |     45632198 | DANCER         |
|  20235 | BANNU    |     91823157 | FOOD      |        600 | CREDIT CARD       | TN  |     98712356 | ENGINEER       |
+--------+----------+--------------+-----------+------------+-------------------+-------------+--------------+----------------+
2 rows in set (0.00 sec)

mysql> select*from custdetails where custoccupation IN('FARMER');
+--------+----------+--------------+-----------+------------+-------------------+-------------+--------------+----------------+
| custid | custname | custmobileno | custorder | custcharge | custpaymentmethod | custaddress | custaadharno | custoccupation |
+--------+----------+--------------+-----------+------------+-------------------+-------------+--------------+----------------+
|  20233 | RAVI     |      7989343 | FOOD      |       1200 | CASH              | AP  |     66498231 | FARMER         |
+--------+----------+--------------+-----------+------------+-------------------+-------------+--------------+----------------+
1 row in set (0.01 sec)

mysql> select sum(custcharge) from custdetails where custorder="FOOD";
+-----------------+
| sum(custcharge) |
+-----------------+
|            2900 |
+-----------------+
1 row in set (0.01 sec)

mysql> select avg(custcharge) as Average from custdetails;
+-----------+
| Average   |
+-----------+
| 1300.0000 |
+-----------+
1 row in set (0.04 sec)

mysql>  select min(custcharge) as Minimum from custdetails;
+---------+
| Minimum |
+---------+
|     600 |
+---------+
1 row in set (0.01 sec)

mysql>  select max(custcharge) as Maximum from custdetails;
+---------+
| Maximum |
+---------+
|    2000 |
+---------+
1 row in set (0.00 sec)

mysql>
